asr_result,correct_answer,similarity
打开便签,打开便签,1.0000000000000002
属蛇的本月的事业运势,属蛇的本月的事业运势,0.9999999999999999
八达岭长城票贵吗,八达岭长城票贵吗,1.0
摇个硬币,摇个硬币,1.0
双鱼座今日的幸运数字,双鱼座今日的幸运数字,0.9999999999999999
唐人街探案是谁演的,唐人街探案是谁演的,1.0000000000000002
我要自拍,我要自拍,nan
27岁是属什么的,27岁是属什么的,0.9999999999999999
下载王者荣耀,下载王者荣耀,1.0
搜搜文档丢了怎么办,搜搜文档丢了怎么办,0.9999999999999999
我想知道属狗的今年的财运怎么样,我想知道属狗的今年的财运怎么样,0.9999999999999998
1吨等于多少千克,一吨等于多少千克,0.8892969299104718
打开相机设置,打开相机设置,1.0000000000000002
调高屏幕亮度,调高屏幕亮度,1.0000000000000002
用大众点评看一下我附近的美食,用大众点评看一下我附近的美食,1.0
最近上映的电影,最近上映的电影,1.0
广东的美食推荐,广东的美食推荐,1.0
我想看上周拍的照片,我想看上周拍的照片,0.9999999999999998
打开wifi,打开wifi,1.0
识别邮箱地址,识别邮箱地址,1.0
病毒性感冒的传播途径,病毒性感冒的传播途径,1.0
海口今天可以穿什么衣服,海口今天可以穿什么衣服,0.9999999999999998
搞笑的动态图,搞笑的动态图,1.0
我想我想从中国产生,我想从中关村去天安门,0.7775302317103067
我想从中关村去天安门,我要看海绵宝宝,0.35114316674139956
我要看海绵宝宝,我要骑摩拜单车,0.21487051216458314
我要骑摩拜单车,找壁纸,0.19480292441139205
找壁纸,我想看小狗的图片,0.404707805735764
我想看小狗的图片,养胃的食材,0.47204106404720464
养胃的食材,搜索复仇者联盟的预告片,0.4158659945574815
搜索复仇者联盟的预告片,打开勿扰模式,0.4748475144018796
打开勿扰模式,我要问诊,0.43840956969983946
我要问诊,美好的一天用法语怎么说,0.2963981349583535
美好的一天用法语怎么说,打开虚空引擎,0.3855926848586048
打开虚空引擎,孟子的国籍,0.3234603892143444
孟子的国籍,我现在在哪里,0.29445203313064955
我现在在哪里,伦敦现在几点了,0.5724562764857245
伦敦现在几点了,电视剧知否知否,0.24680067870968836
电视剧知否知否,一美元等于多少人民币,0.24584408045300976
一美元等于多少人民币,搜搜胃一直疼怎么办,0.35810617250847415
说说胃一直疼怎么办,关于天枰座的神预测,0.3959566097343069
关于天秤座的神预测,打开支付宝付钱,0.3025443198081505
打开支付宝付钱,吃什么可以降火,0.3466243164461613
吃什么可以降火,男生不和女生吵架的真实原因,0.43373672686757003
男生不和女生吵架的真实原因,消灭奥特曼的计划,0.5288674748698164
消灭奥特曼的计划,给15201010101充100元话费,0.3572320112055472
给15201010101充100元话费,来电音乐,0.29188806062871936
来电音乐,打开ofo扫一扫,0.3100376474059227
打开ofo扫一扫,你和我的倾城时光,0.2700446895026514
你和我的倾城时光,几点了,0.3182697409323722
几点了,你的妈妈是谁,0.31242957452451625
你的妈妈是谁,吐槽大会第三季,0.20136958713684658
吐槽大会第三季,用嘀嘀打车去公司,0.2876807266323171
用滴滴打车去公司,早起的好处,0.3976857407596699
早起的好处,用后置摄像头拍小视频,0.37351413183975885
用后置摄像头拍小视频,骑车导航去东直门,0.5165518796885846
骑车导航去东直门,调节音量到50,0.47293180003541896
调节音量到50,为你明灯三千,0.3626716897827759
为你明灯3000,蜡笔小新,0.2299557247443756
蜡笔小新,明天的紫外线强吗,0.2759162485827738
明天的紫外线强吗,昨天限行尾号,0.4462883543769043
昨天限行尾号,播放跑车的声音,0.3250424404286593
播放跑车的声音,有哪些关于天蝎座的神预测,0.49170429727560533
有哪些关于天蝎座的神预测,双子座的性格怎么样,0.6606493727733521
双子座的性格怎么样,流感怎么预防,0.39446927310019425
流感怎么预防,有风油精的表情包吗,0.41821539837717814
有风油精的表情包吗,姚明有多高,0.4937112068272588
姚明有多高,打电话给中国联通,0.2642273726363541
打电话给中国联通,故宫的价格门票,0.36655238366705173
故宫的价格门票,打开人像拍照模式,0.4110257946796855
打开人像拍照模式,听歌,0.3838299523165301
听歌,你好小爱,0.2237367933250498
你好小艾,我要听东北话,0.25891927359579703
我要听东北话,截屏照片,0.29273078324315693
截屏照片,打开微信小程序跳一跳,0.38562291833407747
打开微信小程序跳一跳,红烧肉怎么做,0.43972510424857847
红烧肉怎么做,识别其中的电话,0.3192204250837047
识别其中的电话,净坛使者是谁,0.3203421688051421
净坛使者是谁,开启录像模式,0.27605022862096884
开启录像模式,用美团定个十点半的餐位,0.3445070968281123
用美团定个十点半的单位,最近空气质量如何,0.26437072290883035
最近空气质量如何,看小猪佩奇,0.2970785393092911
看小猪佩奇,迪丽热巴的微博,0.2701084963971007
迪丽热巴的微博,我的便签,0.5843308108475863
我的便签,早上好怎么翻译,0.3021339323139639
早上好怎么翻译,呼叫顺丰快递,0.37262815778408886
呼叫顺丰快递,导航去最近的加油站,0.3868126087181014
导航去最近的加油站,吃鸡教会了我们什么,0.49152570519594946
吃鸡教会了我们什么,来段广东话,0.4605614854443849
来段广东话,我想看蒙面唱将猜猜猜,0.5114054956511593
我想看蒙面唱将猜猜猜,继续播放,0.4184694953218493
继续播放,天兆家园的开发商,0.24097787359221395
天兆家园的开发商,冰雪大世界的营业时间,0.4840450900170631
冰雪大世界的营业时间,农业银行目前的行情,0.5341877392748644
农业银行目前的行情,天蝎座今天的运势如何,0.5465038222986077
天蝎座今天的运势如何,牙齿发酸怎么办,0.39718713008899553
牙齿发酸怎么办,根号3加根号2等于多少,0.3759208616824379
根号三加根号二等于多少,我想给小李发qq信息说天气真好,0.39206188167928074
我想给小李发qq信息说天气真好,播放一首唐诗,0.3636974773022524
播放一首唐诗,打开淘宝天猫超市,0.2934100377925976
打开淘宝天猫超市,熊爸爸的十万个为什么,0.35880293037166494
熊爸爸的十万个为什么,打开支付宝查看转账记录,0.34182972482507673
打开支付宝查看转账记录,水瓶座的优点有哪些,0.34477623192793366
水瓶座的优点有哪些,聊天,0.25515753449207457
聊天,打开京东发现,0.16607418106152505
打开京东发现,查看微博本地新闻,0.3928496452716693
查看微博本地新闻,锄禾日当午的下一句是什么,0.36172098510248124
锄禾日当午的下一句是什么,韭菜适合与什么一起吃,0.5756893068742727
韭菜适合与什么一起吃,打开热点,0.30314417440462027
打开热点,最近有风吗,0.2468614196381625
最近有风吗,吃什么可以补钙,0.33163989633844954
我想看彭于晏的图片,我要看彭于晏的图片,0.8717219173848546
1米等于多少厘米,一米等于多少厘米,0.878139189348064
微信查找妈妈,微信查找妈妈,0.9999999999999998
端午节为什么要吃粽子,端午节为什么要吃粽子,1.0000000000000002
北冥有哈,北冥有哈,1.0
播放电钻声音,播放电钻声音,0.9999999999999998
明天几点日出,明天几点日出,0.9999999999999998
我想听民谣,我想听民谣,1.0
