asr_result,correct_answer,similarity
打开便签,打开便签,1.0000000000000002
属蛇的本月的事业运势,属蛇的本月的事业运势,0.9999999999999999
八达岭长城票贵吗,八达岭长城票贵吗,1.0
摇个硬币,摇个硬币,1.0
双鱼座今日的幸运数字,双鱼座今日的幸运数字,0.9999999999999999
唐人街探案是谁演的,唐人街探案是谁演的,1.0000000000000002
我要自拍,我要自拍,nan
下载王者荣耀,27岁是属什么的,0.29831509205071616
搜搜文档丢了怎么办,下载王者荣耀,0.35491561354634
我想知道属狗的今年的财运怎么样,搜搜文档丢了怎么办,0.4158040335952391
1吨等于多少千克,我想知道属狗的今年的财运怎么样,0.40752624272105
打开相机设置,一吨等于多少千克,0.34594220206686016
调高屏幕亮度,打开相机设置,0.44590204151465984
用大众点评看下我附近的美食,调高屏幕亮度,0.3958533394793595
最近上映的电影,用大众点评看一下我附近的美食,0.49978905025133546
广东的美食推荐,最近上映的电影,0.423399460037472
我想看上周拍的照片,广东的美食推荐,0.4773601180040535
打开wifi,我想看上周拍的照片,0.33247276641485984
识别邮箱地址,打开wifi,0.4667739807212586
病毒性感冒的传播途径,识别邮箱地址,0.4190594165539673
海口今天可以穿什么衣服,病毒性感冒的传播途径,0.45938735485161547
搞笑的动态图,海口今天可以穿什么衣服,0.37519779670925163
我想从中关村去天安门,搞笑的动态图,0.3074231177394414
我要看海绵宝宝,我想从中关村去天安门,0.35114316674139956
我要骑摩拜单车,我要看海绵宝宝,0.21487051216458314
找壁纸,我要骑摩拜单车,0.19480292441139205
我想看小狗的图片,找壁纸,0.404707805735764
养胃的食材,我想看小狗的图片,0.47204106404720464
搜索复仇者联盟的预告片,养胃的食材,0.4158659945574815
打开勿扰模式,搜索复仇者联盟的预告片,0.4748475144018796
我要问诊,打开勿扰模式,0.43840956969983946
美好的一天用法语怎么说,我要问诊,0.2963981349583535
打开虚空引擎,美好的一天用法语怎么说,0.3855926848586048
孟子的国籍,打开虚空引擎,0.3234603892143444
我现在在哪里,孟子的国籍,0.29445203313064955
伦敦现在几点了,我现在在哪里,0.5724562764857245
电视剧知否知否,伦敦现在几点了,0.24680067870968836
一美元等于多少人民币,电视剧知否知否,0.24584408045300976
搜搜胃一直疼怎么办,一美元等于多少人民币,0.35810617250847415
关于天秤座的神预测,搜搜胃一直疼怎么办,0.37382849727303136
打开支付宝付钱,关于天枰座的神预测,0.3304604049724761
吃什么可以降火,打开支付宝付钱,0.3466243164461613
男生不和女生吵架的真实原因,吃什么可以降火,0.43373672686757003
消灭奥特曼的计划,男生不和女生吵架的真实原因,0.5288674748698164
给152010101015100元话费,消灭奥特曼的计划,0.3094593801328564
来电音乐,给15201010101充100元话费,0.29188806062871936
打开ofo扫一扫,来电音乐,0.3100376474059227
你和我的倾城时光,打开ofo扫一扫,0.2700446895026514
几点了,你和我的倾城时光,0.3182697409323722
你的妈妈是谁,几点了,0.31242957452451625
吐槽大会第三季,你的妈妈是谁,0.20136958713684658
用滴滴打车去公司,吐槽大会第三季,0.2838815827818109
早起的好处,用嘀嘀打车去公司,0.3708920042603969
用后置摄像头拍小视频,早起的好处,0.37351413183975885
骑车导航去东直门,用后置摄像头拍小视频,0.5165518796885846
调节音量到五零,骑车导航去东直门,0.47921420475535303
为你明灯3000,调节音量到50,0.4311430717824253
蜡笔小新,为你明灯三千,0.20199529738235597
明天的紫外线强吗,蜡笔小新,0.2759162485827738
昨天限行尾号,明天的紫外线强吗,0.4462883543769043
播放跑车的声音,昨天限行尾号,0.3250424404286593
有哪些关于天蝎座的神预测,播放跑车的声音,0.49170429727560533
双子座的性格怎么样,有哪些关于天蝎座的神预测,0.6606493727733521
流感怎么预防,双子座的性格怎么样,0.39446927310019425
有风油精的表情包吗,流感怎么预防,0.41821539837717814
姚明有多高,有风油精的表情包吗,0.4937112068272588
打电话给中国联通,姚明有多高,0.2642273726363541
故宫的价格门票,打电话给中国联通,0.36655238366705173
打开人像拍照模式,故宫的价格门票,0.4110257946796855
听歌,打开人像拍照模式,0.3838299523165301
你好小艾,听歌,0.28430547544241175
我要听东北话,你好小爱,0.24830462402707207
截屏照片,我要听东北话,0.29273078324315693
打开微信小程序跳一跳,截屏照片,0.38562291833407747
红烧肉怎么做,打开微信小程序跳一跳,0.43972510424857847
识别其中的电话,红烧肉怎么做,0.3192204250837047
净坛使者是谁,识别其中的电话,0.3203421688051421
开启录像模式,净坛使者是谁,0.27605022862096884
用美团定个十点半的餐位,开启录像模式,0.3445070968281123
最近空气质量如何,用美团定个十点半的餐位,0.26298758541687567
看小猪佩奇,最近空气质量如何,0.2970785393092911
迪丽热巴的微博,看小猪佩奇,0.2701084963971007
我的便签,迪丽热巴的微博,0.5843308108475863
早上好怎么翻译,我的便签,0.3021339323139639
呼叫顺丰快递,早上好怎么翻译,0.37262815778408886
导航去最近的加油站,呼叫顺丰快递,0.3868126087181014
吃鸡教会了我们什么,导航去最近的加油站,0.49152570519594946
来段广东话,吃鸡教会了我们什么,0.4605614854443849
我想看蒙面唱将猜猜猜,来段广东话,0.5114054956511593
继续播放,我想看蒙面唱将猜猜猜,0.4184694953218493
天兆家园的开发商,继续播放,0.24097787359221395
冰雪大世界的营业时间,天兆家园的开发商,0.4840450900170631
农业银行目前的行情,冰雪大世界的营业时间,0.5341877392748644
天蝎座今天的运势如何,农业银行目前的行情,0.5465038222986077
牙齿发酸怎么办,天蝎座今天的运势如何,0.39718713008899553
根号三加根号二等于多少,牙齿发酸怎么办,0.41497457142779254
我想给小李发qq信息说天气真好,根号3加根号2等于多少,0.409754318451802
播放一首唐诗,我想给小李发qq信息说天气真好,0.3636974773022524
打开淘宝天猫超市,播放一首唐诗,0.2934100377925976
熊爸爸的十万个为什么,打开淘宝天猫超市,0.35880293037166494
打开支付宝查看转账记录,熊爸爸的十万个为什么,0.34182972482507673
水瓶座的优点有哪些,打开支付宝查看转账记录,0.34477623192793366
聊天,水瓶座的优点有哪些,0.25515753449207457
打开京东发现,聊天,0.16607418106152505
查看微博本地新闻,打开京东发现,0.3928496452716693
锄禾日当午的下一句是什么,查看微博本地新闻,0.36172098510248124
韭菜适合与什么一起吃,锄禾日当午的下一句是什么,0.5756893068742727
打开热点,韭菜适合与什么一起吃,0.30314417440462027
最近有风吗,打开热点,0.2468614196381625
吃什么可以补钙,最近有风吗,0.33163989633844954
我要看彭于晏的图片,吃什么可以补钙,0.383820783950208
1米等于多少厘米,我要看彭于晏的图片,0.3208985012219042
微信查找妈妈,一米等于多少厘米,0.26393998601643637
端午节为什么要吃粽子,微信查找妈妈,0.35285204001239884
北冥有哈,端午节为什么要吃粽子,0.3009321487387151
播放电视声音,北冥有哈,0.17016051000579757
明天几点日出,播放电钻声音,0.25728029697196547
我想听民谣,明天几点日出,0.3388256633996529
,我想听民谣,nan
